{
  "$schema": "https://json-schema.org/draft/2020-12/schema",
  "$id": "urn:dumbmoney:schema:windows-services:v1",
  "title": "DumbMoney Windows service templates",
  "type": "object",
  "additionalProperties": false,
  "required": [
    "schema_version",
    "product",
    "installation_authority",
    "deployment_scope",
    "telemetry_publication",
    "readiness_schema",
    "readiness_ttl_seconds",
    "research_worker_boundary",
    "services"
  ],
  "properties": {
    "schema_version": {
      "const": "dumbmoney.windows-services.v1"
    },
    "product": {
      "const": "DumbMoney"
    },
    "installation_authority": {
      "const": "PLAN_ONLY"
    },
    "deployment_scope": {
      "const": "PRIVATE_LOCAL_WINDOWS"
    },
    "telemetry_publication": {
      "const": "DISABLED"
    },
    "readiness_schema": {
      "type": "string"
    },
    "readiness_ttl_seconds": {
      "type": "integer",
      "minimum": 1,
      "maximum": 120
    },
    "research_worker_boundary": {
      "type": "object",
      "additionalProperties": false,
      "required": [
        "identity",
        "identity_kind",
        "windows_service",
        "credential_targets",
        "secret_refs",
        "network_allowlist",
        "research_artifact_root",
        "write_roots",
        "read_roots",
        "artifact_write_mode",
        "broker_authority",
        "model_access",
        "command_execution",
        "bundle_handoff",
        "forbidden_host_identities"
      ],
      "properties": {
        "identity": {
          "const": "DumbMoneyResearchWorker"
        },
        "identity_kind": {
          "const": "NON_SERVICE_LOCAL_ACCOUNT"
        },
        "windows_service": {
          "const": false
        },
        "credential_targets": {
          "const": []
        },
        "secret_refs": {
          "const": []
        },
        "network_allowlist": {
          "const": []
        },
        "research_artifact_root": {
          "const": "C:\\ProgramData\\DumbMoney\\research-worker\\artifacts\\objects"
        },
        "write_roots": {
          "const": [
            "%PROGRAMDATA%\\DumbMoney\\spool\\model\\requests",
            "%PROGRAMDATA%\\DumbMoney\\research-worker\\artifacts\\objects"
          ]
        },
        "read_roots": {
          "const": [
            "%PROGRAMDATA%\\DumbMoney\\spool\\model\\responses",
            "%PROGRAMDATA%\\DumbMoney\\spool\\model\\outcomes",
            "%PROGRAMDATA%\\DumbMoney\\research-worker\\artifacts\\objects"
          ]
        },
        "artifact_write_mode": {
          "const": "CONTENT_ADDRESSED_CREATE_ONCE_CONFLICT_FAIL"
        },
        "broker_authority": {
          "const": "NONE"
        },
        "model_access": {
          "const": "TYPED_FILE_SPOOL_ONLY"
        },
        "command_execution": {
          "const": "UNTRUSTED_OFFLINE_ONLY"
        },
        "bundle_handoff": {
          "const": "IMMUTABLE_HASH_PINNED_ONLY"
        },
        "forbidden_host_identities": {
          "const": [
            "DumbMoneyCore",
            "DumbMoneyResearchMesh",
            "DumbMoneyModelGateway",
            "DumbMoneyDummyKalshi",
            "DumbMoneyDopeyRobinhood"
          ]
        }
      }
    },
    "services": {
      "type": "array",
      "minItems": 5,
      "maxItems": 5,
      "items": {
        "type": "object",
        "additionalProperties": false,
        "required": [
          "name",
          "display_name",
          "role",
          "command_ref",
          "dependencies",
          "broker_authority",
          "secret_refs",
          "config_bindings",
          "network_allowlist",
          "write_roots",
          "readiness_descriptor"
        ],
        "properties": {
          "name": {
            "type": "string"
          },
          "display_name": {
            "type": "string"
          },
          "role": {
            "type": "string"
          },
          "command_ref": {
            "type": "string",
            "pattern": "^DUMBMONEY_[A-Z_]+_COMMAND$"
          },
          "dependencies": {
            "type": "array",
            "uniqueItems": true,
            "items": {
              "type": "string"
            }
          },
          "broker_authority": {
            "enum": [
              "NONE",
              "KALSHI",
              "ROBINHOOD"
            ]
          },
          "secret_refs": {
            "type": "array",
            "uniqueItems": true,
            "items": {
              "type": "string",
              "pattern": "^secret-ref:"
            }
          },
          "config_bindings": {
            "type": "object",
            "minProperties": 1,
            "additionalProperties": {
              "type": "string",
              "pattern": "^(credential-target|config-ref|endpoint-ref|readiness-ref|path-ref):"
            }
          },
          "network_allowlist": {
            "type": "array",
            "uniqueItems": true,
            "items": {
              "type": "string"
            }
          },
          "write_roots": {
            "type": "array",
            "uniqueItems": true,
            "items": {
              "type": "string"
            }
          },
          "readiness_descriptor": {
            "type": "string"
          }
        }
      }
    }
  }
}
